{
    "$schema": "http://json-schema.org/draft-07/schema#",
    "$id": "event.json",
    "title": "Event",
    "description": "An event in the scriptures.",
    "type": "object",
    "properties": {
        "id": {
            "description": "The unique identifier of the event.",
            "type": "string",
            "format": "uuid"
        },
        "name": {
            "description": "The name of the event.",
            "type": "string"
        },
        "description": {
            "description": "A description of the event.",
            "type": "string"
        },
        "sources": {
            "description": "The sources that describe the event.",
            "type": "array",
            "items": {
                "type": "string"
            }
        },
        "date": {
            "description": "The date of the event, if it occurred at a specific time, or the date of the event's beginning, if it was a period of time.",
            "$ref": "date.json"
        },
        "end_date": {
            "description": "The date of the event's end, if it was a period of time.",
            "$ref": "date.json"
        },
        "location": {
            "description": "The location of the event.",
            "type": "object",
            "properties": {
                "name": {
                    "description": "The name of the location.",
                    "type": "string"
                },
                "description": {
                    "description": "A description of the location.",
                    "type": "string"
                }
            }
        },
        "participants": {
            "description": "The participants in the event.",
            "type": "array",
            "items": {
                "type": "string"
            }
        },
        "relative_events": {
            "description": "Events that this event is definitely after or before.",
            "type": "object",
            "properties": {
                "before": {
                    "description": "Events that this event is definitely before.",
                    "type": "array",
                    "items": {
                        "#ref": "event.json"
                    }
                },
                "after": {
                    "description": "Events that this event is definitely after.",
                    "type": "array",
                    "items": {
                        "#ref": "event.json"
                    }
                }
            }
        }
        
    }
}