{
    "name": "Alma fights iniquity within the church",
    "description": "Alma saw the wickedness of the church, and he saw also that the example of the church began to lead those who were unbelievers on from one piece of iniquity to another, thus bringing on the destruction of the people.",
    "sources": ["Alma 4:11"],
    "date": {
        "calendar_system": "reign-of-the-judges",
        "year": 9,
        "miscellaneous": "commencement"
    },
    "participants": ["Alma", "Saints"]

}