{
    "name": "Pahron~1~ appointed Chief Judge",
    "description": "Pahoran~1~ appointed Chief Judge and Governor with an oath and sacred ordinance.",
    "location": {
        "name": "Zarahemla"
    },
    "participants": [
        "Pahoran~1~"
    ],
    "date": {
        "year": 24,
        "calendar_system": "reign-of-the-judges",
        "miscellaneous": "end"
    },
    "sources": [
        "Alma 50:39-40"
    ]
}